Title,Title_URL,Rating,Date,Position,Status,Location,View7,View8,View9,View10,helpfulness
Great company and culture,https://www.glassdoor.com/Reviews/Employee-Review-Fidelity-Investments-RVW78586463.htm,5.0,"Jul 26, 2023",High Net Worth Service Associate,Current Employee,,Pros,"Benefits, flexibility, and culture make fidelity a great place to work",Cons,Mobility can be tricky if you don’t put in the time,
Overall great company to work for,https://www.glassdoor.com/Reviews/Employee-Review-Fidelity-Investments-RVW77767533.htm,4.0,"Jun 27, 2023",Associate Accountant,"Current Employee, more than 1 year","Boston, MA",Pros,Great benefits. Good yearly bonuses. Great offices and amenities. Always room to grow and move horizontally in the company,Cons,"Pay could be better, but benefits balance it out. “Old school” atmosphere but getting better.",
Pay is not worth the role,https://www.glassdoor.com/Reviews/Employee-Review-Fidelity-Investments-RVW78328212.htm,3.0,"Jul 17, 2023",Financial Customer Associate,"Current Employee, more than 1 year",,Pros,"Easy role, decent work life balance. Management is solid",Cons,The people you work with on the phones are often rude or dumb. The stats that are directly connected to incentives and bonuses are often uncontrollable,1
A lifetime career,https://www.glassdoor.com/Reviews/Employee-Review-Fidelity-Investments-RVW77326256.htm,5.0,"Jun 13, 2023",Senior Client Service Administrator,Current Employee,,Pros,"Company culture is amazing, always trying to not side with anyone when it comes to politics, caring about social action, lots of giving back to the community. Clear ways to develop, enormous number of resources to learn and grow, career coaching, amazing benefits. Dynamic working between office and WFH. Awesome amenities including on site clinic and gym.",Cons,Not the best place for people that prefer to work alone and not interact with colleagues.,
Good Place,https://www.glassdoor.com/Reviews/Employee-Review-Fidelity-Investments-RVW78124331.htm,5.0,"Jul 10, 2023",Transacation Processing Analyst,"Current Employee, more than 1 year","Fort Wright, KY",Pros,- Good Management - Easy work while I was there - Decent pay and nice people,Cons,- They tell you there's upward mobility. It can feel limited - Work can be boring and monotonous,1
Dependent on what Adviser you are aligned with,https://www.glassdoor.com/Reviews/Employee-Review-Fidelity-Investments-RVW72456865.htm,5.0,"Jan 9, 2023",Planning Consultant,"Current Employee, more than 5 years","Denver, CO",Pros,"If you have a great team and adviser you are supporting, its one of the best jobs at Fidelity. Communication is key and management likes you to take ownership of your results and tell them about successes and what you would like to be upskilled on",Cons,"If you have an adviser you are supporting that is disengaged or doesn't involve you, it can be hard to get enough work or compete with the other Planning consultants you will be ranked against for performance reviews and bonuses.",
Woke Serfdom,https://www.glassdoor.com/Reviews/Employee-Review-Fidelity-Investments-RVW76397270.htm,1.0,"May 13, 2023",Financial Services Representative,"Current Employee, more than 1 year","Lone Tree, CO",Pros,Very few. The benefits are trendy. Decent time off.,Cons,"Weak 401(k), training is sub par, support for certain job functions is non existent, no real career paths (except get off the phones ASAP), lack of experience and skill with most managers, antiquated processes and technology, a lot of Woke cultural provisions, sub par compensation, ineffective organizational structure for dealing with customer requests and processing (The call centers are US based, but processing is oveseas), the Diversity and Inclusion area is non representational of the work force and does not hold much value, and the organization does not understand that its primary focus should be to be the best financial services organization versus a Woke culture factory.",6
Very resourceful,https://www.glassdoor.com/Reviews/Employee-Review-Fidelity-Investments-RVW78587304.htm,4.0,"Jul 26, 2023",Client Relationship Associate,Former Employee,"Westlake, TX",Pros,"For any problems you may have or face, Fidelity has the resources for them. Team leader was available for any questions for majority of shifts.",Cons,Very meticulous about their craft.,
It was okay,https://www.glassdoor.com/Reviews/Employee-Review-Fidelity-Investments-RVW77725613.htm,3.0,"Jun 26, 2023",Customer Relationship Advocate,"Former Employee, less than 1 year","Smithfield, RI",Pros,"Good pay and benefits, onboarding trainers are extremely awesome.",Cons,"Your job relies on you passing the Sie, series 7 and series 63. It can be a lot of pressure.",2
Great company overall,https://www.glassdoor.com/Reviews/Employee-Review-Fidelity-Investments-RVW75743658.htm,4.0,"Apr 22, 2023","Director, Project Manager","Current Employee, more than 10 years","Merrimack, NH",Pros,"Great people, good overall benefits, never bored, innovation encouraged, privately held company yet large and established business enables Fidelity to invest in new ideas and its people and company to thrive,",Cons,"Work-live ballance not always the best, but It has gotten better over the years. Pay and culture may vary a bit depending on what part of Fidelity you work on. To succeed, you generally need to move to various groups within the company to grow professionally and to be considered for larger roles. This is not always the case, but even within the same company within Fidelity you should plan to consider that else be pigeon-holed.",
Good place for Innovation,https://www.glassdoor.com/Reviews/Employee-Review-Fidelity-Investments-RVW76836615.htm,5.0,"May 27, 2023",Senior Full Stack Engineer,"Current Employee, more than 3 years","Durham, NC",Pros,Best place to work with good employee benefits. The CEO is always innovates the direction for the employees. You can experience all the modern technologies to help you upskill in carrier One of the big privately owned company. The job involves lot of learnings through out your life time. Fun places to experience all the cultural parties goes all over the year. The biggest tech gaint's in the trading industry.,Cons,I am happy working at fidelity. It all depends how you work for the company.,
Wonderful,https://www.glassdoor.com/Reviews/Employee-Review-Fidelity-Investments-RVW76914567.htm,5.0,"May 30, 2023",Financial Associate,"Current Employee, more than 1 year","Covington, KY",Pros,A ton of opportunities to grow and explore.  Benefits for both full and part timers. Good pay. Supportive crew and management. Tons of activities to engage and contribute in,Cons,It’s a phone center job as their biggest role. That’s not everyone’s cup of tea. Micromanaging on the phones. Stingy about time off if it is not scheduled even if it’s an emergency,
Culture is amazing,https://www.glassdoor.com/Reviews/Employee-Review-Fidelity-Investments-RVW77680633.htm,3.0,"Jun 24, 2023",Customer Relationship Advocate,Former Employee,"Smithfield, RI",Pros,"Everyone was welcoming, especially managers. Very helpful and want you to succeed. A lot of support to pass Series 7 and 63 exams.",Cons,Customer Service heavy after 8-9 months of training. A lot of pressure and expectations. Micro-managed and a lot of monitoring. Hard to get promoted outside of phone roles.,3
Great Workplace,https://www.glassdoor.com/Reviews/Employee-Review-Fidelity-Investments-RVW78531683.htm,5.0,"Jul 24, 2023",Customer Relationship Advocate,"Current Employee, less than 1 year","Durham, NC",Pros,- Management helps/encourage every associate during licensing process - Benefits are great! - Very helpful team and they care about your success!,Cons,- Licensing process is difficult,
I love working for Fidelity!,https://www.glassdoor.com/Reviews/Employee-Review-Fidelity-Investments-RVW78292783.htm,5.0,"Jul 16, 2023",Workplace Planning Consultant II,"Current Employee, more than 1 year","Jacksonville, FL",Pros,"Fidelity Investments has great PTO, Healthcare, and Benefits Package. They have remote role opportunities as well as onsite. There’s opportunity for careeer growth and progression.",Cons,The base pay tends to be lower,
Company that Cares,https://www.glassdoor.com/Reviews/Employee-Review-Fidelity-Investments-RVW78287708.htm,5.0,"Jul 15, 2023",Customer Service Associate,"Current Employee, less than 1 year","Westlake, TX",Pros,"Amazing benefits and work/life balance. A company that puts people, and relationships first. That encourages collaboration, and constant improvement.",Cons,"I cannot think of any negatives. The Westlake regional center is amazing, new and improved.",
Lots of Flexibility with Remote Work,https://www.glassdoor.com/Reviews/Employee-Review-Fidelity-Investments-RVW78058935.htm,5.0,"Jul 7, 2023",High Net Worth Service Associate,"Current Employee, more than 1 year","Seattle, WA",Pros,"Pros: Work from home 100%, Regular development time away from main function of inbound phone calls, and great benefits",Cons,Cons: It's customer service and some days are better than others. Tax season is a particularly busy time of year,
This job has changed my life!,https://www.glassdoor.com/Reviews/Employee-Review-Fidelity-Investments-RVW72985560.htm,5.0,"Jan 25, 2023",Client Relationship Advocate,"Current Employee, less than 1 year","Denver, CO",Pros,"With this job, I'm gaining financial understanding and knowledge that I can apply to my own life. For the first time in years, I have hope for the future. The benefits are unlike any I've ever had. They even pay my student loans! I've been here since May and I have yet to meet an unhappy person, myself included. You're not hired to fill the client services team. You're hired to start your career and they promote relatively quickly. I'm aiming to join the licensing team, since I used to be a teacher. It means a lot that I can use my degrees and experience.",Cons,Licensing is HARD! Fidelity supports you through every step of the process and more of our employees passed the exams than most other firms who hand you a book and give you 30 days to pass or you're out. Your training period is long but you learn a whole lot and the company celebrates every milestone you reach.,1
Mixed feelings,https://www.glassdoor.com/Reviews/Employee-Review-Fidelity-Investments-RVW78166821.htm,4.0,"Jul 11, 2023",Director,Current Employee,"Merrimack, NH",Pros,"Very good benefits, mostly remote",Cons,"Lots of work, you tend to work more when remote and weeks in office you’re always playing catch up on account of commute time. Work life balance can be tough.",1
"I was employed from 2015 - 2017, not 2019",https://www.glassdoor.com/Reviews/Employee-Review-Fidelity-Investments-RVW77529000.htm,5.0,"Jun 19, 2023",Fund Accountant,"Former Employee, more than 1 year","Westlake, TX",Pros,"Great entry level job. Will receive great experience. If you are proficient with vba, and Tableau you will excel.",Cons,"Pay is low, mornings can be hectic because of the nature of mutual funds.",
decent,https://www.glassdoor.com/Reviews/Employee-Review-Fidelity-Investments-RVW78508024.htm,5.0,"Jul 23, 2023",Associate Software Engineer,Current Employee,"Boston, MA",Pros,-work life balance - 401k - benefits - growth opportunities,Cons,- low pay - bureaucracy and politics,
Good if you can pass,https://www.glassdoor.com/Reviews/Employee-Review-Fidelity-Investments-RVW77594568.htm,4.0,"Jun 21, 2023",Customer Relationship Advocate,"Former Employee, more than 1 year","Durham, NC",Pros,"It’s a good place to grow your career IF you can pass the tests. But there is a lot of support to help you pass. Great benefits, great leaders. It’s a big company but I never felt like just a number to them.",Cons,Everything is centered around the tests. Extremely stressful. No work life balance,
Great place to build your career,https://www.glassdoor.com/Reviews/Employee-Review-Fidelity-Investments-RVW77892107.htm,5.0,"Jul 2, 2023",Financial Consultant,"Current Employee, more than 3 years","Danvers, MA",Pros,Supportive and collaborative environment. Dynamic work arrangement supported by Fidelity’s commitment to invest in technology.,Cons,Compensation somewhat limited compared to volume produced elsewhere.,
Great job - no longer remote,https://www.glassdoor.com/Reviews/Employee-Review-Fidelity-Investments-RVW71827679.htm,3.0,"Dec 13, 2022",Transition Services Specialist,"Current Employee, more than 1 year","Salt Lake City, UT",Pros,Great company culture Advancement opportunities Good training program Good compensation,Cons,"We are being forced back into in person work - I started working here as a remote worker during the pandemic and was recently told (without much notice) we are being forced back to the office one week a month starting in January - there is no flexibility in which week (you are assigned) nor is there the option to just do in office one day a week the whole month. This is very difficult as an involved dad - with commute I have to leave at 6:30AM and don’t get home until 6PM - working from home my day is 8AM-4:30PM. This change will be hard on my kids, as I will not be able to be as involved in their evening activities.",5
"Great Company, not excited about the push for back to office",https://www.glassdoor.com/Reviews/Employee-Review-Fidelity-Investments-RVW77275197.htm,4.0,"Jun 11, 2023",System Analyst,Current Employee,"Durham, NC",Pros,"Great company to work work, surrounded by talented and driven people. The pay and benefits are good.",Cons,"Not a fan of the connect week, since for some (myself included), their entire team is in different locations, so you come into the office to collaborate on Zoom.",1
Great place to work!,https://www.glassdoor.com/Reviews/Employee-Review-Fidelity-Investments-RVW76559242.htm,5.0,"May 18, 2023",Team Leader,"Current Employee, more than 5 years",Dallas-Fort Worth,Pros,Love the culture and atmosphere here Management gives me the flexibility to create my own goals and plans Encourages career growth and development Great benefits Great work life balance,Cons,"Pay is probably the only gripe i have. With exception to a few departments and areas, we are largely underpaid for our markets.",
Soar program,https://www.glassdoor.com/Reviews/Employee-Review-Fidelity-Investments-RVW77978703.htm,4.0,"Jul 5, 2023",Soar Associate,"Former Employee, more than 1 year","Westlake, TX",Pros,"Great people, great benefits, wonderful amenities in office.",Cons,Hr is a nightmare. Constantly making things complicated and painful and a nightmare. Not much flexibility. Avoid talking to HR if possible and pray you never need to ask for an exception to any policy.,
Great company,https://www.glassdoor.com/Reviews/Employee-Review-Fidelity-Investments-RVW78178229.htm,5.0,"Jul 12, 2023",College Planning Specialist,"Current Employee, more than 1 year","Covington, KY",Pros,"Culture, benefits, opportunity to grow, leadership",Cons,"Being on the phone can be draining, but worth it if you can work through putting in the time and effort to move to a non phone role",
Vice President Level Roles,https://www.glassdoor.com/Reviews/Employee-Review-Fidelity-Investments-RVW78068540.htm,5.0,"Jul 8, 2023",Vice President,"Current Employee, more than 10 years","Boston, MA",Pros,"Excellent firm, very well run. Positioned extremely well for decades to come.",Cons,"Very political, demanding, long hours. A fast paced driven culture that requires high level of work ethic and execution.",1
If you value your mental health don't work here.,https://www.glassdoor.com/Reviews/Employee-Review-Fidelity-Investments-RVW78368909.htm,1.0,"Jul 18, 2023",Production Supervisor,"Current Employee, less than 1 year","Tampa, FL",Pros,* breaks *pay Not a lot of cons in that job.,Cons,"*Disrespectful to women, men there including management like to gaslight and rise their voices to women there. * No respect for work life balance. *Poor Training. * Bad and dangerous work conditions. * Being blamed for management bad decisions.",4
Had a strong start but the company is not what it used to be,https://www.glassdoor.com/Reviews/Employee-Review-Fidelity-Investments-RVW71197430.htm,1.0,"Nov 18, 2022",IT Does Not Matter,"Current Employee, more than 8 years",,Pros,- 401K - Healthcare (Dental is lousy!) - Technology/Tools to do your job,Cons,- DEI out of control - Mandatory on-site work 5 days straight! So much for flexibility. - Miserable/Dull Buildings feel like you are in a prison (Campus sites have lousy cafeterias),11
"Bad Unit, Great Company",https://www.glassdoor.com/Reviews/Employee-Review-Fidelity-Investments-RVW77256122.htm,3.0,"Jun 10, 2023",Lead Pensions Administrator,"Former Employee, less than 1 year","Richmond, VA",Pros,Fidelity Investments is a great company. Bonuses are quarterly. Was there for nine months and received a raise. Student loans assistance. Flexible schedule.,Cons,Training was terrible. Was there for nine months and had no idea what I was doing. Asked for more assistance but was put on a smaller client with no training.,1
"Good Company, Terrible Leadership/Mangement",https://www.glassdoor.com/Reviews/Employee-Review-Fidelity-Investments-RVW75361696.htm,3.0,"Apr 10, 2023",Financial Representative,Former Employee,"Tigard, OR",Pros,"Great national backing, good training, and resources.",Cons,"Local Issues. Terrible management and leadership, also at the Portland location (which recently closed). Surprisingly, a lack of understanding of financial concepts and strategies across the board, and emphasis apparently on communication or the appearance of intelligence rather than you know... Shockingly out of touch with many things, ironically opposed or maybe uninformed? of the CEO's vision, especially on new innovative asset classes. Probably shouldn't have expected much from a retail finance location, might be the place for you if your into the business of business, cronyism, networking, have other non-finance retail or sales experience or wanting to get a foot in the door",2
Great Culture to Work with Benefits,https://www.glassdoor.com/Reviews/Employee-Review-Fidelity-Investments-RVW78128119.htm,5.0,"Jul 10, 2023",Senior Full Stack Developer,"Current Employee, more than 1 year","Texas City, TX",Pros,Best place and always encourage new development and help in carrier growth,Cons,Nice place to work but now we need to go to back to office.,
Stop dynamic weeks,https://www.glassdoor.com/Reviews/Employee-Review-Fidelity-Investments-RVW77972892.htm,2.0,"Jul 5, 2023",Senior Scrum Master,"Current Employee, more than 8 years","Durham, NC",Pros,Great company to work for when they arent trying to force people in that live 6 hours away,Cons,Forcing folks in that live too far away,2
Manager WI PS,https://www.glassdoor.com/Reviews/Employee-Review-Fidelity-Investments-RVW78319889.htm,5.0,"Jul 17, 2023",Manager,"Current Employee, more than 10 years","Westlake, TX",Pros,Amazing company with even better benefits and growth opportunities,Cons,Slow at hiring process and providing constructive feedback,
Good pay and benefits for what the job is but you’re a robot,https://www.glassdoor.com/Reviews/Employee-Review-Fidelity-Investments-RVW62663017.htm,3.0,"Apr 12, 2022",Financial Customer Associate II,"Former Employee, less than 1 year","Covington, KY",Pros,"- Pay was good for what it was; received pay increase within 3-4 months to compete with other financial institutions. 
- Benefits and retirement plan (medical, dental, vision, 401k, stock program)
- 16 week paid training program (8:30am-5:00pm)
- some of the people you meet and community events etc
- good resume builder if you need to help build it
- diversity",Cons,"- Once you are out of the training program you are 12pm-8pm ET. This seems okay at first and if you’re a night owl, but it wears on you. You can advance ur way to a better time slot but if you start a new role that’s the same sort of field, you go back to 12-8pm and have to work your way back up.
- Stats; you have to meet call criteria which some is understandable but then you have situations that they don’t train you on and your stuck ruining your stats. 
- You feel like a robot and are really just a number. Saying the same things over and over to every customer can get tiring especially some of them are super rude and impatient.
- a good manager and a bad one here affects ur motivation to do the same exact thing over and over again
- hourly salary; they tell you and send you an offer that it’s a salary position but are paid by the hour",16
"Great WLB, Not so competitive conpensation",https://www.glassdoor.com/Reviews/Employee-Review-Fidelity-Investments-RVW77489944.htm,5.0,"Jun 18, 2023",Senior Business Analyst,"Current Employee, more than 3 years","Merrimack, NH",Pros,Great Work-Life Balance. Hardly anyone bothers post 4 PM on weekdays unless there's something urgent.,Cons,Fewer growth options and well-established practices stop you from thinking out of the box. Not so generous when it comes to offering salary packages to employees.,
Great Company but can be a tough job,https://www.glassdoor.com/Reviews/Employee-Review-Fidelity-Investments-RVW75831195.htm,4.0,"Apr 25, 2023","Customer Service Representative, Call Center","Former Employee, less than 1 year","Covington, KY",Pros,"Great benefits like retirement, healthcare options, s tudent loan assistance, and vacation. They pay well and do make you feel like they care about you. Also, Beautiful campus. Plenty of learning opportunities and advancement opportunities. If you are good with people and can brush off a toxic customer, like following a strict schedule, and can deal with a schedule that changes day to day, then this is a great job. I also made some lifelong friends there.",Cons,"Dealing with people's money can be difficult, and when it is over the phone, people can be very rude. Your time is constantly monitored by software. I didn't have a consistent break schedule, and I found it difficult to eat on demand. I don't deal well with toxic people, so it was a very stressful job. I also felt completely drained most days. Since there are so many clients and each have its own rules/policies, it felt like I took a 8-hour test most days. Most of the time I used my breaks to meditate from customers. But if you can handle that. This won't be an issue. My biggest issue was the software time management that tracked every second of your time. I found that really stressful. Not because I wanted to slack, but quite the opposite. I wanted to be perfect on time, and sticking to the schedule that changed every day was very tough. I'm a pretty smart, energetic, and confident person, but this took its toll on me.",1
Great Career,https://www.glassdoor.com/Reviews/Employee-Review-Fidelity-Investments-RVW78272746.htm,5.0,"Jul 14, 2023",Service Support Specialist,"Current Employee, more than 3 years",,Pros,Great role with growth opportunities for those that put in the hard work.,Cons,It is still a phone role.,
"Excellent job, needs more direction",https://www.glassdoor.com/Reviews/Employee-Review-Fidelity-Investments-RVW77691527.htm,5.0,"Jun 25, 2023",Central Relationship Manager,"Current Employee, more than 3 years","Houston, TX",Pros,"Amazing work life balance, purely outbound dials, remote position (not all) and hands off leadership approach",Cons,"No direct path career wise, have to work on that on your own, can ask leadership but initiative is on you",
Great Company,https://www.glassdoor.com/Reviews/Employee-Review-Fidelity-Investments-RVW78447712.htm,4.0,"Jul 20, 2023",Investment Solutions Representative,"Current Employee, more than 1 year","Jacksonville, FL",Pros,Benefits Flexibility Work/Life Balance Training Profit Sharinf,Cons,The pay they provide does not keep up with inflation.,
Great place to work,https://www.glassdoor.com/Reviews/Employee-Review-Fidelity-Investments-RVW78286434.htm,5.0,"Jul 15, 2023",High Net Worth Service Associate,"Current Employee, more than 1 year","Richmond, VA",Pros,Love this place don’t plan to leave,Cons,Don’t have any so far I love it,
It is what you make it,https://www.glassdoor.com/Reviews/Employee-Review-Fidelity-Investments-RVW76600018.htm,5.0,"May 19, 2023",Relationship Manager,"Current Employee, more than 3 years","Austin, TX",Pros,"Flexibility in your schedule, decide when to do tasks.",Cons,Could get caught between opposing forces with Financial Consultant and Branch Manager telling you what you should be doing.,
Great place,https://www.glassdoor.com/Reviews/Employee-Review-Fidelity-Investments-RVW78415307.htm,5.0,"Jul 19, 2023",Risk Manager,"Current Employee, less than 1 year","New York, NY",Pros,Good interview process met whole team,Cons,Drug test screening not sure,
Care about their employees,https://www.glassdoor.com/Reviews/Employee-Review-Fidelity-Investments-RVW77871707.htm,5.0,"Jun 30, 2023",Customer Relationship Advocate,"Former Employee, less than 1 year","Westlake, TX",Pros,"Fidelity Investments has an abundance of resources for helping not only their employees personal life, but also giving plenty of help in their current position and general career growth.",Cons,Internal promotions can be highly competitive,
Really good place to work,https://www.glassdoor.com/Reviews/Employee-Review-Fidelity-Investments-RVW78316324.htm,5.0,"Jul 17, 2023",Customer Relationship Advocate,"Current Employee, less than 1 year","Denver, CO",Pros,Benefits Environment People are great Management is super supportive,Cons,None that I can think of,
