Title,Title_URL,Rating,Date,Position,Status,Location,View7,View8,View9,View10,helpfulness
Great place,https://www.glassdoor.com/Reviews/Employee-Review-Fidelity-Investments-RVW82198895.htm,5.0,"Nov 29, 2023",Anonymous Employee,"Current Employee, more than 1 year",,Pros,Culture Benefits Employees Leadership Work life balance,Cons,"There are no cons, great place to work.",
Great career-starting company,https://www.glassdoor.com/Reviews/Employee-Review-Fidelity-Investments-RVW20987141.htm,5.0,"Jun 11, 2018",QA Engineer,"Current Employee, more than 3 years","Smithfield, RI",Pros,Benefits including profit sharing and bonuses are great. The breadth of this company provides a great opportunity to try out different career paths or boost your current one.,Cons,"In my current role, I am working overtime more often than I'd like with recognition that seems to only go so far until it sizzles out. That may be tied to the size of the company itself, where promotions work in a ""trickle down"" manner.",226
No respect,https://www.glassdoor.com/Reviews/Employee-Review-Fidelity-Investments-RVW82134231.htm,1.0,"Nov 27, 2023",Regional Support Technician,"Current Employee, more than 5 years","Merrimack, NH",Pros,The benefits are solid... Or so I'm told honestly I don't understand why we don't have a single payer system it's insane that to have health care you need a stable job.  Don't even get me started on dental... What are they?  Luxury bones?,Cons,"Despite the fact that the average employee of this company can't even power on a computer my role is the lowest paid in the company.

To be clear the folks who work from home taking chats/calls who escalate their tickets to my team make more than my team. 

Let's talk numbers.

Inflation in 2021 was around 9% but the average raise for my team was 2%.

2022 was again around 9... But we got a whopping 7%.

That's a pay cut baby.  When we spoke to our leadership they literally told us to go find another job.

What's more is there is no out. You are trapped in this role forever or until you find something better elsewhere.  They offer programs to ""help you progress."" but then banish the techs because they don't want tech people. 

They also abuse the ever living crap out of contractors.  They want you as an employee handling people with millions of dollars in trades laptops but they don't wanna give health care.  Incredible.",3
Ehh...,https://www.glassdoor.com/Reviews/Employee-Review-Fidelity-Investments-RVW82004455.htm,2.0,"Nov 21, 2023",Financial Customer Associate,Current Employee,"Durham, NC",Pros,The starting pay is pretty good for a call center. Great benefits as well.,Cons,"They claim that there are so many different opportunities to grow within the company, but make it impossible to explore those options due to working a strict schedule on the phones. The call volume is back to back with no room to breathe in between calls. You go through 3 months of training and still feel confused at the end. They encourage you to ask questions and reach out for help, but when you reach out for help, you're reprimanded for doing so. You have no say so in your schedule and you have to work between 12pm-8pm so say goodbye to having any type of social life. They offer free therapy and after working there for about a week, you'll quickly understand why.",3
Let Go While 7 Months Pregnant,https://www.glassdoor.com/Reviews/Employee-Review-Fidelity-Investments-RVW80985681.htm,1.0,"Oct 16, 2023",Financial Consultant I,"Former Employee, more than 1 year","Chicago, IL",Pros,I was drawn to the training program for the Financial Consultant role. Good 401k match.,Cons,"I was in a 1 year training program for the Financial Consultant role while completing my CERTIFIED FINANCIAL PLANNER™ certification. I was told I needed to sell more insurance, annuities, and managed accounts in order to continue on as a Financial Consultant. I was let go as soon as I hit the 1 year mark, shortly after I became a CFP® professional. I had told HR that I was pregnant when I became concerned about losing my job and asked to be considered for a different role within Fidelity (since I knew I would not be able to interview and start another job at 7 months pregnant). After I was let go by my manager, I reached back out to HR and they were not even aware that my employment was being terminated. Everyone I dealt with at Fidelity was extremely insensitive to the fact that this would cause a huge amount of stress to me and my family at a time that stress had serious potential health risks to myself and my baby. I ended up being unemployed for close to 9 months. I was interviewing for new jobs while also taking care of a newborn and paying extremely high premiums for health insurance for my family. Only 23% of CFP professionals are women, and only about 15% of financial advisors are women. Even though Fidelity touts its family values and culture, I would not recommend Fidelity to women based on my experience.",18
Not what it seems,https://www.glassdoor.com/Reviews/Employee-Review-Fidelity-Investments-RVW82174148.htm,1.0,"Nov 29, 2023",Client Relationship Advocate,Current Employee,"Covington, KY",Pros,The people outside of the onboarding group are amazing and extremely helpful.,Cons,"Toxic doesn't begin to describe how things are. The onboarding managers openly compare you to others, bring up personal things in 1 on 1s about other associates and make comments about your life like suggesting you should be married or have children by now. They yell at you on the floor in front of the entire facility if you do something they don't like. The don't advocate for people who have disabilities when it comes to learning the material so you're constantly compared to others openly. They require you to work multiple hours a week UNPAID after your schedule and on weekends. They SUGGEST you should work through your breaks and lunches.",2
Great company for long term career,https://www.glassdoor.com/Reviews/Employee-Review-Fidelity-Investments-RVW82013515.htm,4.0,"Nov 22, 2023","Director, Risk Management","Current Employee, more than 10 years","Boston, MA",Pros,"Fidelity has two main driving goals, first is customer experience/satisfaction and the other is retaining talent. These can be challenging to balance at times, but they do their best and are mostly successful at it. Flexible work schedules is primary reason Fidelity is retaining a lot of their talent. It's for these reasons I've been with the company almost 20 years and plan to retire here if possible.",Cons,"Lately the company has been getting a little political and pushing some activist type initiatives, which doesn't sit well with many employees. They of course won't speak up and say much, especially ones who've been around a while. The company needs to stick to financial matters and stay away from woke agendas or they may face backlash even if their intentions are sound.",2
"Good company, but could be so much better",https://www.glassdoor.com/Reviews/Employee-Review-Fidelity-Investments-RVW81361811.htm,4.0,"Oct 29, 2023",User Experience Designer,"Current Employee, more than 1 year","Research Triangle Park, NC",Pros,"Encourages career mobility, benefits, work/life balance, dynamic working option for those who want it (1 week in office for local remote workers), own entire end-to-end initiatives in 1 business unit or just projects in the other, ux team apart from product team but still integrated, some autonomy on how you work, ux culture, company culture, maintains accessibility standards, employee resource groups, learning day every 2 weeks",Cons,"Slow production cycle, corporate red tape, some product directions are not defined, communication from management, managers not knowing how to manage,  new design systems every few years, hard to get promotions within team unless you're a white male,  boys club, enforcement of connect weeks (no flexibility of when you come in & forcing us to come in in the first place), promotes agile but doesnt practice it well, strained ux research team and limited access to users, wants to sacrifice ux principles for sake of visual alignment",2
Constant opportunity for development and growth for those who want it,https://www.glassdoor.com/Reviews/Employee-Review-Fidelity-Investments-RVW6026362.htm,5.0,"Mar 2, 2015",Anonymous Employee,"Current Employee, more than 10 years","Westlake, TX",Pros,"Large, privately held firm with values that are reinforced at all levels of leadership. Career opportunities are ongoing and the vast majority of people at the firm will help you progress if you're willing to do the work.
Fidelity provides exceptional benefits with options based on personal needs and various family situations. While pay and bonus structures are sometimes criticized, being patient will pay off for those who are willing to wait.",Cons,"Fidelity retail is open 24 hours, causing scheduling conflicts for some candidates
Career tracks within the firm can be limited due to licensing requirements, or lack of licensing flexibility in the groups",184
Good but not great,https://www.glassdoor.com/Reviews/Employee-Review-Fidelity-Investments-RVW81524689.htm,3.0,"Nov 3, 2023",Associate Director,"Former Employee, more than 10 years",,Pros,Over 10 yrs with the company and there is a lot to like about Fidelity. Their 401k match and profit sharing is impressive. Great starting place for a career. Career mobility is available yet there can be ceilings for advancement. Their products and platform solutions are also quite good. Truly a client centric organization and is focused on maintaining that perception. Their approach during Covid was pretty level-headed.,Cons,"Consistent theme where senior mgmt proved to be disinterested and detached from the happenings on the ground. In retrospect, there is also an unhealthy fear within the workforce. There was always a worry about a rumored layoff and then those that always make a point to ‘appear busy.’ Often you will hear from peers or managers that the grass isn’t always greener or that you should think twice before leaving. Other comments regarding excessive workload expectations and having a stressful work environment are also understated. That is pretty consistent across the channels.",3
Great place to work,https://www.glassdoor.com/Reviews/Employee-Review-Fidelity-Investments-RVW81971986.htm,4.0,"Nov 20, 2023",Senior Service Support Specialist,Current Employee,"New York, NY",Pros,"Fidelity is a great place to work for several compelling reasons. Firstly, the company's commitment to fostering a collaborative and inclusive culture sets it apart. Employees at Fidelity experience a supportive environment that values diversity and encourages open communication. Secondly, Fidelity places a strong emphasis on professional development, offering numerous opportunities for career growth and skill enhancement. The company's dedication to innovation and cutting-edge technology ensures that employees have the tools and resources to excel in their roles. Lastly, Fidelity's unwavering focus on work-life balance and its recognition of employee contributions through various programs make it an employer of choice, creating a positive and rewarding experience for its workforce.",Cons,work life balance not always the best call center environment,
"Great Benefits and Managers, but Old-fashioned approach to work",https://www.glassdoor.com/Reviews/Employee-Review-Fidelity-Investments-RVW81727629.htm,4.0,"Nov 10, 2023",Retirement 401(K) Plan Associate,"Former Employee, less than 1 year","Westlake, TX",Pros,"6% 401(k) match, Volunteer time off in addition to Paid time off. PTO is about five work weeks. Managers are very understanding of your personal life. Career development is great; you get promoted quickly. They also have a ""Fidelity Made"" program for people interested in tech.",Cons,"Upper leadership doesn't listen to employees. Every quarter, they require employees to come into the office more and more, and they took away the free meal on top of that. So you end up spending a lot of money going to work. They kept saying, ""It was always our intention to go back to the office."" even though the majority of the people who work there were hired during the lockdown and were attracted because of the remote option.",3
Fidelity EA,https://www.glassdoor.com/Reviews/Employee-Review-Fidelity-Investments-RVW81871031.htm,2.0,"Nov 16, 2023",Executive Assistant,Current Employee,,Pros,the people. the technology. working remote.,Cons,"EAs pigeonholed. Managers not willing to support career advancement. Feeling of not being a part of a team and unappreciated, undervalued. Reporting to an Admin instead of Senior Executives. Low pay scale compared to other large Boston firms.",1
Amazing entry-level opportunity with great benefits,https://www.glassdoor.com/Reviews/Employee-Review-Fidelity-Investments-RVW81501600.htm,4.0,"Nov 2, 2023",Financial Associate,"Former Employee, more than 3 years","Westlake, TX",Pros,"I enjoyed all the essential skills, especially in customer service, and retirement planning that I developed during my experience at Fidelity. I also appreciate how amazing the benefits were and how well I was trained to excel on the job.",Cons,Servicing 60+ calls each day can be exhausting especially during the early to the middle of the year. I also believe that I didn't receive as much support as I would've liked in career growth based on the areas I was interested in within the company based on my overall interests.,1
It was good until it wasn't,https://www.glassdoor.com/Reviews/Employee-Review-Fidelity-Investments-RVW81062899.htm,3.0,"Oct 18, 2023",UX Design Director,Current Employee,,Pros,"Generally a good place to work. Decent pay. Great benefits. Relatively high UX maturity. Out of the hundreds of people I've met and worked with, there are only a handful that I wouldn't want to work with again, which I think says a lot.",Cons,"D&I efforts are limited and often just checking boxes. Win awards for employing women, but is still very much dominated by men. Very cheap regarding training and conferences. Once you've been there a while, your pay becomes less and less competitive with the market. Performance is competitive (only certain percentage can be at top), which hurts collaboration and is demoralizing when you do great work and aren't recognized for it.",7
"Great Culture, Great Underpay",https://www.glassdoor.com/Reviews/Employee-Review-Fidelity-Investments-RVW81996756.htm,3.0,"Nov 21, 2023",Investment Solutions Representative,Current Employee,,Pros,"Good support system and benefits, lots of opportunity to move up and they allow a decent work life balance",Cons,"Pay is not where it should be with the level of work you do with clients, days can be long and you can be talking to people about very complicated investments and goals with little reward. They underpay then offer a quarterly bonus that you have absolutely have to grind all quarter to get the full amount which still doesn’t add up to what your worth",2
Positive Experience,https://www.glassdoor.com/Reviews/Employee-Review-Fidelity-Investments-RVW82194032.htm,5.0,"Nov 29, 2023",Director,"Former Employee, more than 8 years","Boston, MA",Pros,"People, technology, culture, and benefits were all very strong. Only left because a great offer for more money came up outside or else could have stayed for decades.",Cons,"Its a company of 60,000 so it's hard to go outside the box with new ideas without it taking years for approval and through several layers",
Racist Manager & Definition of Micromanaging,https://www.glassdoor.com/Reviews/Employee-Review-Fidelity-Investments-RVW82193973.htm,1.0,"Nov 29, 2023",Customer Relationship Advocate,"Former Employee, more than 1 year","Greenwood Village, Arapahoe, CO",Pros,The licensing training program was good,Cons,"Despite the company promoting "" how friendly/ welcoming their company culture is"", the manager I had was racist and unprofessional and I had to report HIM AND FIDELITY to EESO. 
They also brainwash you into thinking you are some sort of ""financial professional"" --this is just a call center job...
 Believe every single negative review you see here cuz they are true!!!
If you like to work at a Cult--this is the place for you!",2
They care about their employees,https://www.glassdoor.com/Reviews/Employee-Review-Fidelity-Investments-RVW81646910.htm,3.0,"Nov 8, 2023",Investment Solutions Representative,"Current Employee, more than 3 years","Orlando, FL",Pros,They seem to care more about their employees than most other firms I’ve worked. Maybe bc they’re private but would recommend for culture over other firms.,Cons,Pay. They also have a hierarchy for promotions that isn’t as seamless or lateral as they like to showcase it to be. There is a lot of competition since there is a lot of folks w your exact skill set in your exact role gunning for your desired position and can be make it really timely or difficult to advance if you have your eyes set on a specific role. (Or location),2
Excellent Organization to grow with,https://www.glassdoor.com/Reviews/Employee-Review-Fidelity-Investments-RVW81836699.htm,5.0,"Nov 15, 2023",Customer Relationship Advocate,"Former Employee, less than 1 year","Durham, NC",Pros,"They enable potential employees with the tools, vision, and experience of what their future will encompass once they are onboarded. They help you to become successful in your career journey at Fidelity.",Cons,"I can't say this is a con, although the rigorous testing and interviewing process can be tedious and intimidating to some.",
Good Benefits,https://www.glassdoor.com/Reviews/Employee-Review-Fidelity-Investments-RVW81918788.htm,4.0,"Nov 18, 2023",Principal Software Engineer Test,"Current Employee, less than 1 year","Westlake, TX",Pros,"Good Work culture - But it will depend on the team and the manager. Good 401K match and Profit sharing - Will take care of your retirement. You can use the net salary for other things and not worry about the retirement,",Cons,"If you join in Feb or Mar you will work for 11 or 10 months in that year and won't be eligible for the profit sharing next year. Vs someone joining in Nov or Dec, they may not get profit sharing for just 1 or 2 months. This to me look little unfair.",
Equitable,https://www.glassdoor.com/Reviews/Employee-Review-Fidelity-Investments-RVW79459401.htm,5.0,"Aug 24, 2023",Customer Relationship Advocate,"Current Employee, more than 1 year","Salt Lake City, UT",Pros,"They really lookout for your mental health and assist with non-work related wellness. As part of the many benefits are support for family support, maternity/paternity leave, access to mental health support, student loan reimbursement, home buying assistance, and concierge to assist with basically anything! I can't cover everything they do for you here, it's a village for you and your family to build a career on. The company really believes, if you're a well rounded individual- your satisfaction will be mirrored in the client's satisfaction.",Cons,"Pay is lower starting out than other companies, but the benefits and work/life balance (only required to be in office 1 week out of the month) more than makes up for the lower pay. while the company is working to create a more equitable workspace, the employees themselves are often clicky (whether it's religious or gender based). Things are getting better, but it will take more time for the overall culture to change.",3
Good experience,https://www.glassdoor.com/Reviews/Employee-Review-Fidelity-Investments-RVW82209423.htm,4.0,"Nov 30, 2023",401k Specialist,"Former Employee, more than 1 year",,Pros,Good people and potential for networking,Cons,"micromanagement, promotions vertically, and true manager 1-1 development",1
Call Center,https://www.glassdoor.com/Reviews/Employee-Review-Fidelity-Investments-RVW81065412.htm,4.0,"Oct 18, 2023",Customer Relationship Advocate,Former Employee,,Pros,"Really good benefits, WFM options, clean facilities, paid licensing, friendly managers and teammates, strong company culture",Cons,"The company is fine but this is a call center role. Once you finish your licensing, you're on the phones or on chats most of the time. Clients can be demanding and your success is dependent on your metrics. The only way to move into a new role is by being really efficient with your calls, regardless of your other qualifications or if the desired role is even on the phones.",2
Work,https://www.glassdoor.com/Reviews/Employee-Review-Fidelity-Investments-RVW82158425.htm,3.0,"Nov 28, 2023",Finance,"Former Employee, more than 3 years","Jersey City, NJ",Pros,"Nice people, professional environment and office space was very nice",Cons,Too many meetings during the week,
Excellent company,https://www.glassdoor.com/Reviews/Employee-Review-Fidelity-Investments-RVW82074269.htm,4.0,"Nov 24, 2023",Anonymous Employee,"Current Employee, more than 3 years","Philadelphia, PA",Pros,I work remotely and my schedule is very flexible. I’ve never felt micromanaged in the 3 years I’ve worked for Fidelity. I can’t say enough good things,Cons,Salary is good.- but could be better,
Overall great place to start my career,https://www.glassdoor.com/Reviews/Employee-Review-Fidelity-Investments-RVW81756434.htm,5.0,"Nov 12, 2023",Associate Actuary,"Current Employee, less than 1 year","Durham, NC",Pros,"Great people, great office with great amenities. My managers are excellent people and have been training me well in my role. I am getting a manageable workload with plenty of leeway for my study time. Overall great place to work, although I don't have much to compare it to since this is my first full time job.",Cons,"This job is in consulting, which may appeal to everyone.",
Company Culture Took a Nose Dive,https://www.glassdoor.com/Reviews/Employee-Review-Fidelity-Investments-RVW80494311.htm,1.0,"Sep 28, 2023",Communication Consultant,"Former Employee, more than 10 years",,Pros,Robust benefits package that included 7% 401k match and profit sharing.,Cons,"Fidelity used to be a champion for their associates but after requiring employees to work remotely for over 2 years that came to an abrupt end in favor of real estate value. Associates stepped up to make Fidelity look good and maximize profits when the pandemic started, pivoting to working at home at a moments notice only to be bullied to return to the office and micromanaged despite the overwhelming request of associates to remain remote. Gone is the autonomy and flexibility as ""Big Brother"" started watching your every badge swipe. Go ahead take PTO during a Connect Week, but be prepared to have to make those days up in the office. The required in-office attendance wasn't really helping with collaboration, associates kept earbuds in and to themselves anyway and still attended all meetings virtually. Associates who moved hundreds, or even thousands of miles away from a Fidelity campus were not exempt from the Connect Week requirements forcing many great associates to leave the company.",15
Great workplace,https://www.glassdoor.com/Reviews/Employee-Review-Fidelity-Investments-RVW82097207.htm,5.0,"Nov 26, 2023",Planning Consultant,"Current Employee, more than 1 year","New York, NY",Pros,benefits people career mobility flexibility work life balance is top of mind,Cons,sick time is part of PTO,
Amazing company to work for,https://www.glassdoor.com/Reviews/Employee-Review-Fidelity-Investments-RVW81627426.htm,4.0,"Nov 7, 2023",Retirement Planner,Current Employee,"Salt Lake City, UT",Pros,The people and management at Fidelity are top notch. I feel valued and heard by management. I love the people I work with. There has been exponential room for growth.,Cons,The strict schedule adherence feels like we're being micromanaged. The biggest con is the lack of flexibility in the job. Also can feel burned out by the constant service to planning call model.,3
Not as they seem,https://www.glassdoor.com/Reviews/Employee-Review-Fidelity-Investments-RVW81107852.htm,2.0,"Oct 19, 2023",Customer Relationship Advocate,Former Employee,,Pros,"Great benefits, remote work, and a good starting pay.",Cons,"They don’t tell you that if you don’t pass exams you get fired. They give you 30 days to find a job within the company, but fail to tell you that most jobs either ask for experience or wait till 30 days is up to reapply.",5
Fidelity Boston,https://www.glassdoor.com/Reviews/Employee-Review-Fidelity-Investments-RVW81503341.htm,4.0,"Nov 2, 2023",Sr. Category Manager,"Current Employee, more than 1 year","Boston, MA",Pros,"Good benefits, profit sharing, 401k match up to 6%, time off encouraged. Outgoing teams. The company tries to provide lots of learning, social engagements, training and networking opportunities internally.",Cons,"High stress levels (depending on position), moving towards more in office time than hybrid roles. Key location Boston, but can also work in Smithfield, RI or NH. Likes to start people in contract roles initially. You then have to apply for FTE opportunities. Sometimes very hard to get into, depending on the business unit.",
Ok,https://www.glassdoor.com/Reviews/Employee-Review-Fidelity-Investments-RVW81995671.htm,4.0,"Nov 21, 2023",Financial Services Representative,"Former Employee, more than 3 years","Merrimack, NH",Pros,Good environment and work life balance,Cons,Managerial staff will forget about your request I.E. shift change if you are doing well and if it is not beneficial for them to move you,
Great company to work for.,https://www.glassdoor.com/Reviews/Employee-Review-Fidelity-Investments-RVW81945141.htm,5.0,"Nov 19, 2023",Systems Support Analyst,Current Employee,"Westlake, TX",Pros,Very collaborative and balanced work environment.,Cons,Open floor cubicle layout but that's currently being revamped which is a huge mood changer when in the office,
